<?xml version="1.0" encoding="UTF-8"?>
<!DOCTYPE Import [
    <!ELEMENT Import (Row+)>
    <!ATTLIST Import name CDATA #REQUIRED>
    <!ATTLIST Import query CDATA #REQUIRED>
    <!ELEMENT Row (id, pregunta, opcion_a, opcion_b, opcion_c, correcta, explicacion)>
    <!ELEMENT id (#PCDATA)>
    <!ELEMENT pregunta (#PCDATA)>
    <!ELEMENT opcion_a (#PCDATA)>
    <!ELEMENT opcion_b (#PCDATA)>
    <!ELEMENT opcion_c (#PCDATA)>
    <!ELEMENT correcta (#PCDATA)>
    <!ELEMENT explicacion (#PCDATA)>
]>
<?xml-stylesheet type="text/xsl" href="formulario.xslt"?>
<Import name="test_buscadores"
	query="SELECT `id`, `pregunta`, `opcion_a`, `opcion_b`, `opcion_c`, `correcta`, `explicacion` FROM `proyecto_buscadores`.`test_buscadores`;
">
	<Row>
		<id>1</id>
		<pregunta>¿Qué es exactamente un motor de búsqueda?</pregunta>
		<opcion_a>Un navegador web para acceder a internet</opcion_a>
		<opcion_b>Un sistema informático que busca archivos almacenados en servidores web</opcion_b>
		<opcion_c>Un antivirus que rastrea la web</opcion_c>
		<correcta>B</correcta>
		<explicacion>Un buscador es un sistema que rastrea, indexa y muestra información de la web
			en base a las consultas de los usuarios.</explicacion>
	</Row>
	<Row>
		<id>2</id>
		<pregunta>¿Cuál es la función principal de una &quot;araña web&quot; (web crawler)?</pregunta>
		<opcion_a>Proteger los servidores de ataques con virus</opcion_a>
		<opcion_b>Diseñar la interfaz de las páginas web</opcion_b>
		<opcion_c>Rastrear internet sistemáticamente para indexar su contenido</opcion_c>
		<correcta>C</correcta>
		<explicacion>Las arañas o bots navegan de enlace en enlace descubriendo e indexando nuevas
			páginas para la base de datos del buscador.</explicacion>
	</Row>
	<Row>
		<id>3</id>
		<pregunta>¿Qué significan las siglas SEO?</pregunta>
		<opcion_a>Search Engine Optimization</opcion_a>
		<opcion_b>Secure Enterprise Operation</opcion_b>
		<opcion_c>System Execution Order</opcion_c>
		<correcta>A</correcta>
		<explicacion>SEO (Optimización para Motores de Búsqueda) son las técnicas para mejorar el
			posicionamiento orgánico de una web.</explicacion>
	</Row>
	<Row>
		<id>4</id>
		<pregunta>¿Cuál de estos buscadores destaca y se promociona por no rastrear la información
			del usuario?</pregunta>
		<opcion_a>Bing</opcion_a>
		<opcion_b>DuckDuckGo</opcion_b>
		<opcion_c>Yahoo!</opcion_c>
		<correcta>B</correcta>
		<explicacion>DuckDuckGo es conocido por su enfoque en la privacidad, ya que no guarda el
			historial de búsqueda ni rastrea a sus usuarios.</explicacion>
	</Row>
	<Row>
		<id>5</id>
		<pregunta>¿Qué es una SERP?</pregunta>
		<opcion_a>Un tipo de servidor de bases de datos</opcion_a>
		<opcion_b>La página de resultados que muestra un buscador tras una consulta</opcion_b>
		<opcion_c>El protocolo de seguridad de Google</opcion_c>
		<correcta>B</correcta>
		<explicacion>SERP significa &quot;Search Engine Results Page&quot; (Página de Resultados del
			Motor de Búsqueda).</explicacion>
	</Row>
	<Row>
		<id>6</id>
		<pregunta>¿Qué motor de búsqueda es propiedad de Microsoft?</pregunta>
		<opcion_a>Baidu</opcion_a>
		<opcion_b>Yandex</opcion_b>
		<opcion_c>Bing</opcion_c>
		<correcta>C</correcta>
		<explicacion>Bing es el buscador desarrollado por Microsoft, integrado por defecto en
			navegadores como Edge.</explicacion>
	</Row>
	<Row>
		<id>7</id>
		<pregunta>¿Cuál es el motor de búsqueda más utilizado en Rusia?</pregunta>
		<opcion_a>Google</opcion_a>
		<opcion_b>Yandex</opcion_b>
		<opcion_c>Baidu</opcion_c>
		<correcta>B</correcta>
		<explicacion>Yandex es el buscador líder en Rusia, superando a Google en cuota de mercado en
			ese país.</explicacion>
	</Row>
	<Row>
		<id>8</id>
		<pregunta>¿Y cuál es el motor de búsqueda dominante en el mercado chino?</pregunta>
		<opcion_a>Baidu</opcion_a>
		<opcion_b>Yahoo!</opcion_b>
		<opcion_c>Naver</opcion_c>
		<correcta>A</correcta>
		<explicacion>Baidu es el principal motor de búsqueda en China, adaptado a las regulaciones y
			el idioma local.</explicacion>
	</Row>
	<Row>
		<id>9</id>
		<pregunta>¿Qué diferencia a los resultados orgánicos de los resultados de pago (SEM)?</pregunta>
		<opcion_a>Los orgánicos son imágenes y los de pago son texto</opcion_a>
		<opcion_b>Los orgánicos se ganan por relevancia y SEO, los de pago aparecen mediante pujas
			económicas</opcion_b>
		<opcion_c>No hay diferencia, ambos pagan</opcion_c>
		<correcta>B</correcta>
		<explicacion>Los resultados orgánicos aparecen de forma natural por su calidad, mientras que
			los de pago son anuncios patrocinados.</explicacion>
	</Row>
	<Row>
		<id>10</id>
		<pregunta>¿Qué era el &quot;PageRank&quot; original de Google?</pregunta>
		<opcion_a>El precio que costaba poner un anuncio en la primera página</opcion_a>
		<opcion_b>Un algoritmo que medía la importancia de una web basándose en la cantidad y
			calidad de los enlaces que recibía</opcion_b>
		<opcion_c>Una herramienta para diseñar páginas web</opcion_c>
		<correcta>B</correcta>
		<explicacion>PageRank fue la innovación clave de Google en sus inicios: evaluar la
			relevancia de una web según quién enlazaba hacia ella.</explicacion>
	</Row>
	<Row>
		<id>11</id>
		<pregunta>¿Qué es un metabuscador?</pregunta>
		<opcion_a>Un buscador que busca dentro de otros motores de búsqueda</opcion_a>
		<opcion_b>El buscador más rápido de internet</opcion_b>
		<opcion_c>Un buscador exclusivo para la Deep Web</opcion_c>
		<correcta>A</correcta>
		<explicacion>Un metabuscador carece de base de datos propia y usa las de otros buscadores
			para mostrar resultados (ej. Dogpile, Trivago).</explicacion>
	</Row>
	<Row>
		<id>12</id>
		<pregunta>¿Qué palabra reservada o &quot;operador booleano&quot; se usa para excluir una
			palabra de los resultados?</pregunta>
		<opcion_a>AND</opcion_a>
		<opcion_b>OR</opcion_b>
		<opcion_c>NOT (o el símbolo -)</opcion_c>
		<correcta>C</correcta>
		<explicacion>Usar NOT o el signo menos (-) delante de una palabra le indica al buscador que
			no muestre resultados que contengan ese término.</explicacion>
	</Row>
	<Row>
		<id>13</id>
		<pregunta>¿Cuál fue uno de los primeros motores de búsqueda de texto completo en la Web
			(lanzado en 1994)?</pregunta>
		<opcion_a>Google</opcion_a>
		<opcion_b>WebCrawler</opcion_b>
		<opcion_c>Bing</opcion_c>
		<correcta>B</correcta>
		<explicacion>WebCrawler, creado en 1994, fue el primero en permitir a los usuarios buscar
			cualquier palabra en cualquier página web.</explicacion>
	</Row>
	<Row>
		<id>14</id>
		<pregunta>¿Qué es la indexación?</pregunta>
		<opcion_a>El proceso de añadir sitios web a la base de datos del buscador</opcion_a>
		<opcion_b>El diseño del logo del buscador</opcion_b>
		<opcion_c>La velocidad a la que carga internet</opcion_c>
		<correcta>A</correcta>
		<explicacion>La indexación es el proceso mediante el cual el buscador organiza y guarda la
			información de la web para mostrarla rápido cuando alguien busca.</explicacion>
	</Row>
	<Row>
		<id>15</id>
		<pregunta>¿Qué tipo de contenido suele componer la &quot;Deep Web&quot; que los buscadores
			tradicionales no indexan?</pregunta>
		<opcion_a>Cuentas bancarias, correos privados y bases de datos cerradas</opcion_a>
		<opcion_b>Páginas web muy antiguas</opcion_b>
		<opcion_c>Páginas de noticias internacionales</opcion_c>
		<correcta>A</correcta>
		<explicacion>La web profunda es contenido no indexable por cuestiones de seguridad,
			privacidad o muros de pago, no solo contenido ilegal.</explicacion>
	</Row>
	<Row>
		<id>16</id>
		<pregunta>¿Qué significa la búsqueda &quot;Long Tail&quot; (cola larga)?</pregunta>
		<opcion_a>Buscar palabras que tienen muchas letras</opcion_a>
		<opcion_b>Búsquedas muy específicas y detalladas compuestas por varias palabras</opcion_b>
		<opcion_c>Buscar el historial más antiguo</opcion_c>
		<correcta>B</correcta>
		<explicacion>Las palabras clave &quot;Long tail&quot; son frases más largas y específicas
			(ej. &quot;comprar zapatillas de correr rojas talla 42&quot;).</explicacion>
	</Row>
	<Row>
		<id>17</id>
		<pregunta>¿Qué archivo colocan los administradores web para decirle a los bots de los
			buscadores qué partes no deben rastrear?</pregunta>
		<opcion_a>robots.txt</opcion_a>
		<opcion_b>no-index.html</opcion_b>
		<opcion_c>block-search.xml</opcion_c>
		<correcta>A</correcta>
		<explicacion>El archivo robots.txt se coloca en la raíz de un sitio web para dar
			instrucciones a las arañas de los buscadores.</explicacion>
	</Row>
	<Row>
		<id>18</id>
		<pregunta>¿En qué año se fundó Google?</pregunta>
		<opcion_a>1990</opcion_a>
		<opcion_b>1998</opcion_b>
		<opcion_c>2004</opcion_c>
		<correcta>B</correcta>
		<explicacion>Google fue fundado en septiembre de 1998 por Larry Page y Sergey Brin.</explicacion>
	</Row>
	<Row>
		<id>19</id>
		<pregunta>¿Qué es la &quot;intención de búsqueda&quot;?</pregunta>
		<opcion_a>Lo rápido que un usuario teclea en el buscador</opcion_a>
		<opcion_b>El objetivo principal que tiene un usuario al realizar una consulta</opcion_b>
		<opcion_c>El historial de compras del usuario</opcion_c>
		<correcta>B</correcta>
		<explicacion>La intención de búsqueda puede ser informativa, transaccional o navegacional;
			entenderla es clave para que el buscador dé buenos resultados.</explicacion>
	</Row>
	<Row>
		<id>20</id>
		<pregunta>En el contexto de los buscadores, ¿qué significa que una web sea
			&quot;Responsive&quot;?</pregunta>
		<opcion_a>Que se adapta y se ve bien en dispositivos móviles</opcion_a>
		<opcion_b>Que responde rápido a los correos</opcion_b>
		<opcion_c>Que tiene muchos enlaces internos</opcion_c>
		<correcta>A</correcta>
		<explicacion>Los buscadores (especialmente Google) priorizan las webs responsive porque
			ofrecen una buena experiencia al usuario móvil.</explicacion>
	</Row>
	<Row>
		<id>21</id>
		<pregunta>¿Qué es un algoritmo de búsqueda?</pregunta>
		<opcion_a>Un tipo de virus informático</opcion_a>
		<opcion_b>Un conjunto de reglas matemáticas que deciden qué resultados mostrar y en qué
			orden</opcion_b>
		<opcion_c>El servidor físico donde se guardan las webs</opcion_c>
		<correcta>B</correcta>
		<explicacion>Los algoritmos son las fórmulas y reglas exactas que usan los buscadores para
			clasificar y ordenar las páginas web según su relevancia.</explicacion>
	</Row>
	<Row>
		<id>22</id>
		<pregunta>¿Qué práctica penalizada por los buscadores se conoce como &quot;Keyword
			Stuffing&quot;?</pregunta>
		<opcion_a>Repetir una palabra clave excesivamente en una página para intentar posicionar</opcion_a>
		<opcion_b>Comprar palabras clave en Google Ads</opcion_b>
		<opcion_c>Escribir artículos muy cortos</opcion_c>
		<correcta>A</correcta>
		<explicacion>El Keyword Stuffing es una técnica penalizada que consiste en saturar el texto
			con la misma palabra clave de forma poco natural y repetitiva.</explicacion>
	</Row>
	<Row>
		<id>23</id>
		<pregunta>¿Qué significa que un buscador tenga una versión en &quot;caché&quot; de una web?</pregunta>
		<opcion_a>Que la web es de pago</opcion_a>
		<opcion_b>Que ha guardado una copia temporal de cómo era la página la última vez que la
			rastreó</opcion_b>
		<opcion_c>Que la web está libre de virus</opcion_c>
		<correcta>B</correcta>
		<explicacion>La caché es una captura o copia almacenada por el buscador, muy útil si la
			página original se cae o carga demasiado lento.</explicacion>
	</Row>
	<Row>
		<id>24</id>
		<pregunta>¿Qué buscador de internet destina gran parte de sus beneficios a plantar árboles?</pregunta>
		<opcion_a>Ecosia</opcion_a>
		<opcion_b>Bing</opcion_b>
		<opcion_c>DuckDuckGo</opcion_c>
		<correcta>A</correcta>
		<explicacion>Ecosia es un motor de búsqueda con sede en Berlín que dona el 80% de sus
			beneficios a organizaciones dedicadas a la reforestación.</explicacion>
	</Row>
	<Row>
		<id>25</id>
		<pregunta>¿A qué nos referimos con &quot;SEO Local&quot;?</pregunta>
		<opcion_a>Optimizar una web para que aparezca en búsquedas de una ciudad o región específica</opcion_a>
		<opcion_b>Crear una web en un idioma local o dialecto</opcion_b>
		<opcion_c>Buscar archivos en el disco duro local de nuestro ordenador</opcion_c>
		<correcta>A</correcta>
		<explicacion>El SEO local ayuda a los negocios físicos a destacar en su zona, por ejemplo,
			cuando alguien busca &quot;restaurante cerca de mí&quot; o &quot;fontanero en
			Madrid&quot;.</explicacion>
	</Row>
	<Row>
		<id>26</id>
		<pregunta>En el mundo de los buscadores, ¿qué son los &quot;backlinks&quot;?</pregunta>
		<opcion_a>Enlaces ocultos en el código de una página</opcion_a>
		<opcion_b>Enlaces que apuntan desde otras páginas web externas hacia la tuya</opcion_b>
		<opcion_c>Botones del navegador para volver a la página anterior</opcion_c>
		<correcta>B</correcta>
		<explicacion>Los backlinks (enlaces entrantes) son vitales para el SEO, ya que los
			buscadores los interpretan como votos de confianza o recomendaciones hacia tu web.</explicacion>
	</Row>
	<Row>
		<id>27</id>
		<pregunta>¿Qué nombre recibe el robot de rastreo principal de Google?</pregunta>
		<opcion_a>GoogleCrawler</opcion_a>
		<opcion_b>Googlebot</opcion_b>
		<opcion_c>GoogleSpider</opcion_c>
		<correcta>B</correcta>
		<explicacion>Googlebot es el nombre genérico del rastreador web (araña) de Google que
			descubre páginas nuevas y actualizadas para añadirlas a su índice.</explicacion>
	</Row>
	<Row>
		<id>28</id>
		<pregunta>¿Qué indica la métrica CTR (Click-Through Rate) en los resultados de búsqueda?</pregunta>
		<opcion_a>El porcentaje de usuarios que hacen clic en tu enlace tras verlo en los resultados</opcion_a>
		<opcion_b>La velocidad en milisegundos de carga de la página</opcion_b>
		<opcion_c>El número total de resultados que encuentra el buscador</opcion_c>
		<correcta>A</correcta>
		<explicacion>El CTR se calcula dividiendo los clics que recibe tu enlace entre las veces que
			se muestra en pantalla (impresiones), multiplicado por 100.</explicacion>
	</Row>
	<Row>
		<id>29</id>
		<pregunta>¿Para qué sirve un archivo &quot;sitemap.xml&quot;?</pregunta>
		<opcion_a>Para diseñar el mapa de colores y estilos visuales de la web</opcion_a>
		<opcion_b>Para proporcionar a los buscadores una lista estructurada de las páginas del sitio
			que queremos indexar</opcion_b>
		<opcion_c>Para bloquear el acceso a usuarios no deseados</opcion_c>
		<correcta>B</correcta>
		<explicacion>El sitemap ayuda a los rastreadores a entender la jerarquía y estructura del
			sitio, facilitando que encuentren todas las URLs importantes.</explicacion>
	</Row>
	<Row>
		<id>30</id>
		<pregunta>¿Cuál es considerado el primer motor de búsqueda de la historia (creado en 1990)?</pregunta>
		<opcion_a>Archie</opcion_a>
		<opcion_b>Yahoo!</opcion_b>
		<opcion_c>Altavista</opcion_c>
		<correcta>A</correcta>
		<explicacion>Archie, creado por Alan Emtage en 1990, indexaba archivos en servidores FTP
			públicos, mucho antes de que existiera la web moderna.</explicacion>
	</Row>
	<Row>
		<id>31</id>
		<pregunta>¿Qué ocurre cuando encierras una frase entre comillas (ej: &quot;zapatos de
			cuero&quot;) en un buscador?</pregunta>
		<opcion_a>El buscador ignora esas palabras por completo</opcion_a>
		<opcion_b>El buscador busca exactamente esa frase con las palabras en ese orden preciso</opcion_b>
		<opcion_c>El buscador traduce automáticamente la frase a otros idiomas</opcion_c>
		<correcta>B</correcta>
		<explicacion>El uso de comillas es un operador de búsqueda avanzado que fuerza al motor a
			encontrar coincidencias exactas en el texto de las páginas.</explicacion>
	</Row>
	<Row>
		<id>32</id>
		<pregunta>¿Qué es el &quot;Black Hat SEO&quot;?</pregunta>
		<opcion_a>Técnicas de optimización éticas y recomendadas por las directrices de Google</opcion_a>
		<opcion_b>El diseño de webs con fondos oscuros (Modo oscuro) para ahorrar batería</opcion_b>
		<opcion_c>Prácticas engañosas o poco éticas para intentar manipular los resultados de
			búsqueda</opcion_c>
		<correcta>C</correcta>
		<explicacion>El Black Hat SEO busca resultados rápidos infringiendo las normas de los
			buscadores (ej. comprar enlaces masivamente o texto oculto).</explicacion>
	</Row>
	<Row>
		<id>33</id>
		<pregunta>¿Qué función tiene la etiqueta &quot;canonical&quot; en una página web?</pregunta>
		<opcion_a>Indicar al buscador cuál es la versión original de una página para evitar
			problemas de contenido duplicado</opcion_a>
		<opcion_b>Poner la página en el primer puesto automáticamente</opcion_b>
		<opcion_c>Validar el código HTML para que no tenga errores visuales</opcion_c>
		<correcta>A</correcta>
		<explicacion>La etiqueta rel=&quot;canonical&quot; ayuda a consolidar el SEO cuando tienes
			URLs muy similares o idénticas, indicando la preferida al buscador.</explicacion>
	</Row>
	<Row>
		<id>34</id>
		<pregunta>¿Qué empresa compró YouTube en 2006, convirtiéndolo de facto en el segundo
			&quot;buscador&quot; más grande del mundo?</pregunta>
		<opcion_a>Microsoft</opcion_a>
		<opcion_b>Facebook</opcion_b>
		<opcion_c>Google</opcion_c>
		<correcta>C</correcta>
		<explicacion>Google adquirió YouTube en 2006. Hoy en día, su barra de búsqueda procesa más
			consultas de usuarios que muchos buscadores tradicionales juntos.</explicacion>
	</Row>
	<Row>
		<id>35</id>
		<pregunta>¿Qué significa que Google aplique el &quot;Mobile-First Indexing&quot;?</pregunta>
		<opcion_a>Que solo indexa páginas si el usuario está usando un teléfono móvil</opcion_a>
		<opcion_b>Que utiliza predominantemente la versión móvil del contenido para indexar y
			clasificar la web</opcion_b>
		<opcion_c>Que las páginas web diseñadas para ordenador ya no existen</opcion_c>
		<correcta>B</correcta>
		<explicacion>Dado que la mayoría del tráfico es móvil, Google usa la versión móvil de una
			web como principal referencia para evaluar su relevancia.</explicacion>
	</Row>
	<Row>
		<id>36</id>
		<pregunta>¿Qué es el &quot;Knowledge Graph&quot; (Panel de Conocimiento) en los resultados
			de búsqueda?</pregunta>
		<opcion_a>Un gráfico de barras con las estadísticas de visitas diarias de tu web</opcion_a>
		<opcion_b>Un cuadro informativo destacado que responde directamente a la pregunta sin tener
			que hacer clic en un enlace</opcion_b>
		<opcion_c>El mapa interactivo de las oficinas centrales del buscador</opcion_c>
		<correcta>B</correcta>
		<explicacion>El Panel de Conocimiento recopila información de diversas fuentes fiables para
			dar respuestas rápidas y directas en la propia página de resultados.</explicacion>
	</Row>
	<Row>
		<id>37</id>
		<pregunta>Si una araña de búsqueda rastrea tu web y encuentra un error &quot;404&quot;, ¿qué
			significa?</pregunta>
		<opcion_a>Que la página no existe, fue borrada o no ha sido encontrada en el servidor</opcion_a>
		<opcion_b>Que la página ha cargado correctamente y está optimizada</opcion_b>
		<opcion_c>Que la conexión a internet del servidor es demasiado lenta</opcion_c>
		<correcta>A</correcta>
		<explicacion>El código de estado HTTP 404 indica &quot;Not Found&quot; (No encontrado). Si
			el error persiste, los buscadores dejarán de indexar esa URL.</explicacion>
	</Row>
	<Row>
		<id>38</id>
		<pregunta>Antes de que Google dominara el mercado, ¿qué directorio web y buscador era el rey
			indiscutible en los años 90?</pregunta>
		<opcion_a>DuckDuckGo</opcion_a>
		<opcion_b>Bing</opcion_b>
		<opcion_c>Yahoo!</opcion_c>
		<correcta>C</correcta>
		<explicacion>Yahoo! fue el gigante absoluto de internet en los 90, funcionando inicialmente
			como un directorio organizado manualmente por humanos.</explicacion>
	</Row>
	<Row>
		<id>39</id>
		<pregunta>¿Qué diferencia a un enlace &quot;dofollow&quot; de uno &quot;nofollow&quot;?</pregunta>
		<opcion_a>El &quot;dofollow&quot; transfiere autoridad SEO a la página enlazada, el
			&quot;nofollow&quot; le dice al buscador que no lo haga</opcion_a>
		<opcion_b>El &quot;dofollow&quot; es de pago y el &quot;nofollow&quot; es siempre gratuito</opcion_b>
		<opcion_c>El &quot;dofollow&quot; abre en una pestaña nueva, el &quot;nofollow&quot; en la
			misma ventana</opcion_c>
		<correcta>A</correcta>
		<explicacion>Por defecto todos los enlaces son dofollow. El atributo
			rel=&quot;nofollow&quot; se usa para no pasar &quot;link juice&quot; o autoridad SEO
			(ej. en enlaces patrocinados).</explicacion>
	</Row>
	<Row>
		<id>40</id>
		<pregunta>¿Qué es la Búsqueda por Voz (Voice Search)?</pregunta>
		<opcion_a>Páginas web que se leen en voz alta automáticamente para personas ciegas</opcion_a>
		<opcion_b>El uso del habla para interactuar con buscadores o asistentes (ej. &quot;Oye
			Siri&quot;, &quot;Ok Google&quot;)</opcion_b>
		<opcion_c>Mensajes de audio que se envían por redes sociales</opcion_c>
		<correcta>B</correcta>
		<explicacion>La búsqueda por voz ha cambiado la forma de hacer SEO, ya que las consultas
			habladas suelen ser más largas, naturales y en forma de pregunta completa.</explicacion>
	</Row>
	<Row>
		<id>41</id>
		<pregunta>¿Qué operador debes escribir en Google para buscar resultados únicamente dentro de
			una página web específica?</pregunta>
		<opcion_a>inurl:</opcion_a>
		<opcion_b>site:</opcion_b>
		<opcion_c>domain:</opcion_c>
		<correcta>B</correcta>
		<explicacion>El operador &quot;site:ejemplo.com&quot; restringe los resultados de búsqueda
			para que solo muestre páginas de ese dominio concreto.</explicacion>
	</Row>
	<Row>
		<id>42</id>
		<pregunta>¿Para qué sirve el operador de búsqueda &quot;filetype:&quot;?</pregunta>
		<opcion_a>Para encontrar archivos informáticos con un formato específico (como PDF o PPT)</opcion_a>
		<opcion_b>Para borrar archivos temporales del buscador</opcion_b>
		<opcion_c>Para traducir documentos</opcion_c>
		<correcta>A</correcta>
		<explicacion>Añadir &quot;filetype:pdf&quot; a tu búsqueda hará que el motor solo te
			devuelva enlaces directos a documentos en formato PDF.</explicacion>
	</Row>
	<Row>
		<id>43</id>
		<pregunta>¿Qué es el &quot;Zero-click search&quot; o búsqueda sin clic?</pregunta>
		<opcion_a>Cuando el ratón del usuario está roto</opcion_a>
		<opcion_b>Cuando el usuario encuentra la respuesta en la propia página de resultados y no
			necesita hacer clic en ningún enlace</opcion_b>
		<opcion_c>Un error del servidor que no cuenta los clics</opcion_c>
		<correcta>B</correcta>
		<explicacion>Cada vez es más común gracias a los paneles de información directa de los
			buscadores; el usuario obtiene el dato (ej. el clima o una traducción) y se marcha.</explicacion>
	</Row>
	<Row>
		<id>44</id>
		<pregunta>En el contexto actual, ¿qué diferencia a buscadores como Perplexity AI de los
			buscadores tradicionales?</pregunta>
		<opcion_a>Son más lentos porque leen toda la web</opcion_a>
		<opcion_b>No tienen barra de búsqueda, solo funcionan por voz</opcion_b>
		<opcion_c>Utilizan modelos de lenguaje conversacional para redactar una respuesta directa
			citando las fuentes</opcion_c>
		<correcta>C</correcta>
		<explicacion>Buscadores impulsados por IA generativa (como Perplexity o las funciones de IA
			de Google/Bing) procesan múltiples webs y generan una respuesta narrativa en lugar de
			solo dar una lista de enlaces.</explicacion>
	</Row>
	<Row>
		<id>45</id>
		<pregunta>¿Qué función cumple el comodín del asterisco (*) en una búsqueda?</pregunta>
		<opcion_a>Poner la palabra en negrita en los resultados</opcion_a>
		<opcion_b>Sustituir una palabra desconocida o variable dentro de una frase exacta</opcion_b>
		<opcion_c>Bloquear contenido para adultos</opcion_c>
		<correcta>B</correcta>
		<explicacion>Si buscas &quot;los * mosqueteros&quot;, el buscador entenderá que el asterisco
			puede ser cualquier palabra (en este caso, encontrará &quot;tres&quot;).</explicacion>
	</Row>
	<Row>
		<id>46</id>
		<pregunta>¿Qué es la búsqueda inversa de imágenes?</pregunta>
		<opcion_a>Buscar palabras que describan una imagen borrosa</opcion_a>
		<opcion_b>Subir una foto al buscador para encontrar su origen, imágenes similares o
			información sobre lo que aparece en ella</opcion_b>
		<opcion_c>Girar una imagen 180 grados</opcion_c>
		<correcta>B</correcta>
		<explicacion>Herramientas como Google Lens permiten buscar usando una imagen como punto de
			partida en lugar de texto.</explicacion>
	</Row>
	<Row>
		<id>47</id>
		<pregunta>¿Qué miden las &quot;Core Web Vitals&quot; que tanto importan hoy en día a los
			buscadores?</pregunta>
		<opcion_a>La cantidad de palabras clave que tiene el texto de una página</opcion_a>
		<opcion_b>El número de servidores físicos que alojan la web</opcion_b>
		<opcion_c>La experiencia de usuario, evaluando la velocidad de carga, interactividad y
			estabilidad visual</opcion_c>
		<correcta>C</correcta>
		<explicacion>Los buscadores penalizan las webs lentas o que dan saltos al cargar, premiando
			a las que ofrecen una experiencia técnica fluida y rápida.</explicacion>
	</Row>
	<Row>
		<id>48</id>
		<pregunta>¿Qué es un motor de búsqueda &quot;Vertical&quot;?</pregunta>
		<opcion_a>Un buscador especializado en un nicho o tipo de contenido concreto (como
			Skyscanner para vuelos o Amazon para productos)</opcion_a>
		<opcion_b>Un buscador diseñado para leerse en pantallas verticales de móviles</opcion_b>
		<opcion_c>Un buscador que organiza los resultados de abajo hacia arriba</opcion_c>
		<correcta>A</correcta>
		<explicacion>A diferencia de buscadores &quot;horizontales&quot; (como Google) que buscan de
			todo, los verticales se centran en un sector específico.</explicacion>
	</Row>
	<Row>
		<id>49</id>
		<pregunta>¿Qué operador usarías para buscar páginas que contengan un rango de precios o
			fechas (por ejemplo, entre 50 y 100 euros)?</pregunta>
		<opcion_a>Los dos puntos (..)</opcion_a>
		<opcion_b>El símbolo del dólar o euro (€..€)</opcion_b>
		<opcion_c>El guion medio (-)</opcion_c>
		<correcta>A</correcta>
		<explicacion>Poniendo dos puntos entre dos números (ej: cámara 50..100 €) el buscador
			filtrará los resultados para que entren en ese rango numérico.</explicacion>
	</Row>
	<Row>
		<id>50</id>
		<pregunta>En SEO, ¿qué se conoce como &quot;Canibalización de palabras clave&quot;?</pregunta>
		<opcion_a>Cuando otra web te roba el contenido</opcion_a>
		<opcion_b>Cuando dos o más páginas de tu propia web compiten entre sí por posicionar para la
			misma búsqueda</opcion_b>
		<opcion_c>Cuando usas demasiadas palabras clave en un título</opcion_c>
		<correcta>B</correcta>
		<explicacion>La canibalización confunde al buscador porque no sabe cuál de tus páginas es la
			más relevante para esa consulta, dividiendo así tu fuerza SEO.</explicacion>
	</Row>
	<Row>
		<id>51</id>
		<pregunta>¿Para qué sirve la herramienta Google Trends?</pregunta>
		<opcion_a>Para ver qué ropa está de moda</opcion_a>
		<opcion_b>Para analizar la popularidad de una consulta de búsqueda a lo largo del tiempo y
			por regiones geográficas</opcion_b>
		<opcion_c>Para buscar tendencias en la bolsa de valores</opcion_c>
		<correcta>B</correcta>
		<explicacion>Google Trends es vital para el marketing y el SEO, ya que muestra cómo
			evoluciona el interés de los usuarios sobre un tema en concreto.</explicacion>
	</Row>
	<Row>
		<id>52</id>
		<pregunta>¿Qué es el &quot;Pogo-sticking&quot; en el comportamiento de los usuarios en
			buscadores?</pregunta>
		<opcion_a>Cuando el usuario salta de un resultado a otro haciendo clic, volviendo atrás
			rápidamente porque el contenido no le sirve</opcion_a>
		<opcion_b>Cuando el usuario recarga la página muchas veces</opcion_b>
		<opcion_c>El uso de bloqueadores de anuncios</opcion_c>
		<correcta>A</correcta>
		<explicacion>El pogo-sticking es una señal negativa para los buscadores; les indica que esa
			página web no está resolviendo la duda del usuario.</explicacion>
	</Row>
	<Row>
		<id>53</id>
		<pregunta>¿Qué etiqueta HTML se utiliza para indicar a los buscadores el idioma y la región
			a la que va dirigida una página web?</pregunta>
		<opcion_a>lang-target</opcion_a>
		<opcion_b>hreflang</opcion_b>
		<opcion_c>translate-to</opcion_c>
		<correcta>B</correcta>
		<explicacion>La etiqueta &quot;hreflang&quot; asegura que un usuario en España vea la
			versión en español de España (.es) y un usuario en México la versión correspondiente
			(.mx).</explicacion>
	</Row>
	<Row>
		<id>54</id>
		<pregunta>¿Qué función tiene el operador &quot;related:&quot; en una búsqueda?</pregunta>
		<opcion_a>Buscar familiares de una persona</opcion_a>
		<opcion_b>Encontrar sitios web similares o relacionados con una dirección web específica</opcion_b>
		<opcion_c>Buscar sinónimos de una palabra clave</opcion_c>
		<correcta>B</correcta>
		<explicacion>Si buscas &quot;related:marca.com&quot;, el motor te mostrará otras páginas web
			de periódicos deportivos o noticias similares.</explicacion>
	</Row>
	<Row>
		<id>55</id>
		<pregunta>¿A qué se refieren las siglas LSI en el contexto semántico de los buscadores?</pregunta>
		<opcion_a>Logical Server Integration</opcion_a>
		<opcion_b>Latent Semantic Indexing (Indexación Semántica Latente)</opcion_b>
		<opcion_c>Local Search Information</opcion_c>
		<correcta>B</correcta>
		<explicacion>LSI es un método matemático que los buscadores usan para entender el contexto
			identificando palabras que suelen aparecer juntas (ej: si hablas de &quot;Apple&quot;,
			saber si es la fruta o la empresa por palabras como &quot;iPhone&quot; o
			&quot;zumo&quot;).</explicacion>
	</Row>
	<Row>
		<id>56</id>